{
    "$schema": "http://json-schema.org/draft-07/schema#",
    "additionalProperties": false,
    "properties": {
        "$schema": {
            "type": "string"
        },
        "buyFAssetByAgentFactorBIPS": {
            "type": ["string", "number"]
        },
        "feeBIPS": {
            "type": ["string", "number"]
        },
        "mintingPoolCollateralRatioConstant": {
            "type": "number"
        },
        "mintingVaultCollateralRatioConstant": {
            "type": "number"
        },
        "poolExitCollateralRatioConstant": {
            "type": "number"
        },
        "poolFeeShareBIPS": {
            "type": ["string", "number"]
        },
        "poolTopupCollateralRatioConstant": {
            "type": "number"
        },
        "poolTopupTokenPriceFactorBIPS": {
            "type": ["string", "number"]
        },
        "vaultCollateralFtsoSymbol": {
            "type": "string"
        }
    },
    "required": [
        "buyFAssetByAgentFactorBIPS",
        "feeBIPS",
        "mintingPoolCollateralRatioConstant",
        "mintingVaultCollateralRatioConstant",
        "poolExitCollateralRatioConstant",
        "poolFeeShareBIPS",
        "poolTopupCollateralRatioConstant",
        "poolTopupTokenPriceFactorBIPS",
        "vaultCollateralFtsoSymbol"
    ],
    "type": "object"
}
