{
    "vaultCollateralFtsoSymbol": "USDC",
    "feeBIPS": 1000,
    "poolFeeShareBIPS": 4000,
    "mintingVaultCollateralRatioConstant": 1.2,
    "mintingPoolCollateralRatioConstant": 1.2,
    "poolExitCollateralRatioConstant": 1.3,
    "buyFAssetByAgentFactorBIPS": 9000,
    "poolTopupCollateralRatioConstant": 1.1,
    "poolTopupTokenPriceFactorBIPS": 8000
}
